<?xml version = "1.0" encoding="utf-8"?>
<devices xmlns="http://www.w3schools.com"
        xmlns:xsi="http://www.w3.org/2001/XMLSchema-instance"
        xsi:schemaLocation="http://www.w3schools.com devices.xsd">
    <device>
        <name>Mother Board</name>
        <origin>Taiwan</origin>
        <price>99</price>
        <type>
            <peripheral>no</peripheral>
            <wattpower>50</wattpower>
            <cooler>yes</cooler>
            <role>system</role>
            <ports>usb</ports>
        </type>
        <critical>yes</critical>
    </device>

</devices>